0000000000000292	港立法会主席将宴请多国领事英国菲律宾未获邀香港立法会主席曾钰成图片转自大公网新华网11月15日电据香港大公网援引香港信报报道，立法会通过就人质事件制裁菲律宾不久，遇上菲风灾，政府制裁通牒一个月时限未变；但基于人道立场，今午财委会将讨论拨款4000万元予赈灾基金，让本港救援机构申请，以赈灾菲律宾。立法会主席曾钰成下月宴请第一批驻港总领事午宴，不包括菲律宾。下月2日由曾钰成作东宴请驻港总领事午宴，并安排宴后参加导赏团参观立法会大楼，邀请议员出席。立法会秘书处的宴请名单中，有29名总领事或代表出席，包括早前被外交部驻港特派员宋哲狠批勿干涉香港事务的美总领事夏千福，以及法国日本等大国，而主办亚太经合组织期间驱赶本港记者采访的印尼，以及北韩亦获邀；惟不见菲律宾，以及管治殖民地香港的英国。早前热烈讨论制裁菲律宾期间，曾有政党建议应暂停立法会与菲议会的友好交流及联络，以及特区政府除人质事件外，应暂停与菲政府之间的来往。立法会秘书处发言人解释，有关午宴在本立法年度有两次，下月只是第一次，主要宴请新到任的驻港总领事，但没回应没邀菲律宾是否与制裁有关。立法会申诉部收到一封电邮及三名市民来电，反对政府拨款援助菲风灾。曾钰成指示，申诉部把该等意见送交财委会的议员参考。原标题：港立法会主席将宴请多国领事英国菲律宾未获邀
0000000000000294	35岁矿工酷爱收藏：26年间收集3000余枚钱币重庆商报讯重庆能源集团逢春煤矿的矿工银波酷爱收集钱币，26年来，他共收集3000多枚钱币，不仅有中国历朝历代的古钱，还有世界40多个国家的钱币。近日在煤矿办公大楼，35岁的银波向记者介绍，9岁那年，他在河边意外找到乾隆通宝的铜钱，从此对钱币收藏产生浓厚的兴趣。银波表示，在矿区有很多员工都有一些业余爱好，如收藏邮票的收藏像章等，矿区也成立了各种文艺协会组织，定期开展活动。每次开展活动，银波都会毫不吝啬拿出自己收藏的钱币，让同事观看的同时，和他们分享收藏的故事和知识，银波为此成了小有名气的收藏达人。我一眼就能从钱币的图案头像中，分辨出是哪个国家的。银波表示，他最大的愿望就是想收集完世界上所有国家和地区的钱币。本文来源：华龙网重庆商报作者：代庆实习生黎雨寒
0000000000000295	关于2014年农药制剂生产企业延续核准备案的函原材料司备函201421号有关省自治区直辖市工业主管部门：经研究，同意你单位批复的农药制剂生产企业延续核准名单，现予以备案。特此函复。附件：2014年农药制剂企业延续核准备案名单第一批xls
0000000000000296	美射核弹密码：8个0用了15年综合外国媒体12月1日报道，核导弹发射密码一向是美国的最高机密，然而在过去近20年的时间里，该密码竟然只是极其简单极易被破解的00000000。1962年，美国时任总统约翰菲兹杰拉德肯尼迪签署法令，要求所有核导弹配备准予行动装置。这是一套需取得授权才可发射核导弹的安全系统，确保在发射官输入正确密码后，才会发射核导弹。根据核专家的说法，美国军方担心核战争爆发时，指挥中心和通讯线路可能被毁坏，导致士兵在真正需要发射导弹时却无法取得核密码，由此他们决定把核密码设为最简单的00000000。布鲁斯布莱尔曾在1970年至1974年间担任民兵核导弹发射官，他在一篇文章中写道：相较于未经授权发射核导弹，美战略空军司令部更担心密码太复杂而无法实时响应导弹发射命令。更加令人难以置信的是，布莱尔透露，发射清单上甚至间接说明了至关重要的核密码只能是由数字零组成。发射清单上清楚写明，发射官应当仔细检查位于地下发射舱里的锁定操作面板，以确保不会有人不小心在面板上输入除了零以外的其他数字。实际上，这是在告诉我们，密码里只能有数字零。此外，布莱尔还表示，在他担任核导弹发射官时，发射核导弹只需要4个人协力合作。而1977年所有核导弹配备的准予行动装置均被激活后，自1962年被启用至此时的8个0核密码终于更改。
0000000000000298	家人曝曼德拉最新病情：卧床不起情况不是很好网站截图人民网约翰内斯堡12月3日电王欲然据南非通讯社报道，南非前总统曼德拉的女儿马卡兹维曼德拉3日在接受南非国家广播电视公司SABC的采访时称：我无法用一个更合适的词来形容，虽然他曼德拉卧床不起，但他的精神仍然在教导着我，什么是耐心，什么是爱以及什么是宽容。她说：每一分每一秒，他都让我感到惊讶让我感到这个人是如此的坚强，他就像是一位战士。虽然你会看到他正在与死亡做斗争，但他的精神依然存在。马卡兹维在约翰内斯堡举行的曼德拉作品展览后接受SABC采访时说出以上这番话的。曼德拉的妻子格拉萨马歇尔，他的孙子纳达巴曼德拉以及其他家庭成员也一道出席了展览会。纳达巴称：尽管他曼德拉在家中休养治疗期间的情况不是很好，但他仍然和我们在一起。我认为，我们应该为他做些有意义的事情。曼德拉因肺部感染在比勒陀利亚MediClinic医院接受了将近三个月的治疗，并于9月1日获准出院，返回位于约翰内斯堡霍顿地区的家中休养。在其住院期间，南非总统府曾多次发表声明称，曼德拉的病情处在一个危急但稳定的状态中。南非总统祖马最近一次探访曼德拉是在11月18日，当时总统府发言人玛哈拉杰称：曼德拉的病情与此之前有所改善。尽管对他的治疗起到了一定的作用，但其仍处于危急但稳定的状态。
0000000000000299	kË9MÍužDopxÅk³ƒëÃijsfñbt3SÁcÃMUüUÅ79ºKêÍÛbðxûsr½Æßfc8míbFÉïÖU6õ
0000000000000301	警察路边捡早产花生奶生产日期为明年图29日晚，二广高速荆门段巡查民警在路边意外捡到一箱牛奶饮料，更令人起疑的是，这批饮料竟产于数日之后的2014年元旦。难道乳制品的潜规则被警察叔叔无意中撞见了昨日，省高警总队荆门大队官方微博发布此消息。网友们担心，民警或许无意间揭开乳制品黑幕冰山一角。目前，饮料产地河南济源质监部门已介入调查。高速民警介绍，29日晚7时30分许，天色已黑，两名民警沿二广高速公路襄荆段，由北向南巡逻至1684公里荆门牌楼镇路段，发现前方有一小堆散落物。民警停车查看发现是一个破损的小纸箱，内有20多瓶饮料，便将这些饮料清理出高速公路。打开手电筒查看这些饮料时，民警无意中发现，这些高钙花生奶的纸盒外包装上，打印的生产日期是2014年01月01日00：46。高速警察初步判断，这些饮料很可能是因为货物捆绑不严，从运输的货车上遗落下来。昨日，该大队发微博披露此事，根据包装盒上标注的厂址，并请济源市质量技术监督局和济源市食品药品监管局关注这些产自未来的牛奶。民警在微博中用幽默语气质疑道：河南新雨瑞，你们是靠时光机器作业吗根据包装盒上的信息，记者联系了生产厂家河南济源的新雨瑞饮品有限公司，一位自称该公司办公室工作人员的女士表示，公司前段时间确有一批货送到湖北荆门，但否认有花生牛奶这个品种。针对记者反映的情况，该女士认为有可能是假冒产品或他人栽赃陷害。济源当地媒体昨日也介入此事，据济源晨报记者介绍，他们将情况通报给当地质监部门，目前当地质监部门已介入调查。编后众所周知的原因，但凡与牛奶有关的一举一动，总会牵动所有人的神经。高速公路上意外拾获的早产花生奶，事涉食品安全，不可掉以轻心，必须查清事实有个明确的交代。从三聚氰胺到近年来陆续爆出的毒豆芽瘦肉精等食品安全事件，暴露出食品生产流通过程中存在的漏洞，拷问企业道德底线，也促使各级政府将食品安全放在重中之重的位置。如果不是从货车上掉到高速公路上，这箱产于未来的花生奶或许已经进入某个超市某户消费者家中，甚至不排除还有没掉下车的花生奶中，也有早产花生奶已完成送货。生产日期的提前，也许是失误，但更有可能是人为造假，那么这样的饮料难免存在食品安全之忧。希望当地质监部门绷紧神经，尽快将事件查个水落石出，也希望涉事企业积极配合，向公众道出真相。记者吴昌华张万军通讯员熊路徐宏
0000000000000302	和田73级地震
0000000000000304	上海钢贸大王肖家守466亿资产被封肖家守日前上市公司新日恒力发布公告称因金融借款被诉公司实际控制人上海松江钢材城董事长肖家守名下46亿元资产被查封此外肖家守旗下投资公司上海新日所持有的新日恒力8000万股也被冻结。昨日新日恒力股价大跌813。在外界看来素有上海钢贸大王之称的肖家守身陷纠纷钢贸圈的担保借款危机越演越大。466亿元资产被封资料显示现年45岁的肖家守出生于福建是现任上海松江和苏州长三角钢材市场经营管理有限公司董事长同时也是投资公司上海新日和新日恒力钢丝绳股份有限公司的董事长。肖家守在上世纪90年代中期进入钢贸行业在长三角地区拥有两个钢材交易市场旗下资产涉足金融地产开发是沪上地区不折不扣的钢贸大王。2014年1月30日肖旗下上市公司新日恒力公告称由于民生银行上海分行诉公司实际控制人肖家守等金融借款合同纠纷一案的民事裁定书生效因财产担保需要肖持有的466亿元的上海新日新日恒力第一大股东股权被查封查封期为两年同时上海新日所持有的8000万股份亦被司法冻结股份占新日恒力总股本的2920。受此消息利空昨日A股市场上新日恒力开盘即大幅下跌盘面全天低位震荡报收655元跌幅813。钢贸借款危机达顶点在业内看来肖家守陷入借款纠纷与近两年上海地区钢贸圈的借款黑洞不无关联。2008年后随着4万亿投资盛宴的开启钢贸商开始大肆炒作钢材。那会儿长三角地区的很多中小钢贸商三五结群通过交换钢材货存向银行连环担保贷款再把贷来的资金投到地产和股市里套利借款黑洞在钢贸圈越滚越大。一位上海地区的钢贸商表示。2010年后国家出台地产调控政策钢价在2011年迎来暴跌大部分沪上地区钢贸企业陷入巨亏和资金链断裂的境地2012年起很多企业被银行连带追诉钢贸商老板破产跑路的比比皆是。该人士称。钢材分析师刘新伟则认为肖家守旗下资产被查封说明行业危机仍在蔓延。过去一两年还都是小的钢贸企业被起诉和倒闭现在这种在上海地区较大影响力的钢贸企业也出现危机说明钢贸圈的借款危机已经到了集中爆发的顶点。据公开报道除去民生银行外包括工商平安在内的多家银行诉讼肖家守等金融借款纠纷案已多达11笔陷入借款风波的钢贸大王短期仍难以抽身。刘新伟表示2014年借款黑洞会在钢贸圈继续发酵曾经暴利的钢贸企业迎来行业大洗牌在所难免。记者刘溪若
0000000000000306	小记者训练营走进兆麟小学啦12月2日，令小记者们期待已久的晨报小记者训练营活动又开始了，本次活动，我们走进了大连市西岗区兆麟小学，以广播形式面向全校学生授课，20余名资深小记者还与本报编辑王宏萍面对面，针对讲课内容进行了采访和提问，大家学习到了针对不同采访对象应掌握的采访技巧，如何与他人交流沟通，以及校园新闻采写的方法。12月2日下午2时40分，期待已久的小记者训练营走进大连市西岗区兆麟小学，此次活动面向全校学生授课，学生和小记者们都显得十分兴奋。本次主讲人半岛晨报编辑王宏萍告诉同学们，新闻是事实不是我们写作文，更不是自己随意编纂的故事，它必须是客观事实，而且不能是鸡毛蒜皮的事，应该是社会共同关注的事情。新闻工作的最大特点是用事实说话。儿童新闻与成人新闻一个重要的区别，就在于儿童新闻应当更具体一些，多一些精彩的细节，少一些抽象的概括。所以，采访一定要具体细微，不要粗枝大叶浮光掠影。采写校园新闻，首先，内容必须能引起师生关注；其次，形式要活泼，适合学生和老师阅读；第三，简洁明快，篇幅短小王宏萍说，写新闻不是写记叙文，需要对观察采访到的事情进行剪裁加工，就像做衣服要裁剪一样。有些内容需写有些内容需放弃。有同学问，若采访一个人，他不讲心里话，净说大道理，怎么办王宏萍回答说，有些人怕对记者讲了心里话吃亏，故意讲套话，也有不少人并不害怕讲心里话，而是习惯于讲大道理。碰到这种情况，你要冷静，多动脑子，多问一些具体的事情。他她要回答这些具体事情的具体经过，总不能还讲大道理吧这样，采访的内容就比较实实在在了。最后，主讲人提醒同学们，作为小记者写新闻，最好不要学大人的腔调，用学生自己的语气，毫不掩饰才质朴动人。半岛晨报海力网记者肖以上内容来自：半岛晨报
0000000000000309	xLûODÒ1ìbÄùŒrFdquáÆxÃÛÿUdãûˆÆœÓŸŠ3ŠçÇâüéÜdýLšWËCGGö5ãIþìøcEØàóe²3bÅÍƒÍY0DºÂB89¾6GÃÈ9JÆFÏÍkíµeŽ1ÛCM0ÇÕŸiÙÇÙè½mVˆìƒÑÖµÐ½žaþÿzlw93ëEÃüÓþxayaÜÅÇbùŽòÖÊyÐ
0000000000000310	一周图片精选1141110新闻频道央视网中国网络电视台网站地图客服设为首页您好，帐号未激活马上激活退出您好，VIP邮箱免费邮箱微博社区博客播客论坛观看记录退出选择去向VIP邮箱免费邮箱微博社区博客播客论坛登录form首页新闻经济体育综艺春晚戏曲音乐科教青少文化艺术公益产经汽车旅游健康时尚三农商城社区微博博客论坛访谈邮箱游戏电视频道大全栏目大全节目大全直播中国赛事直播网络电视客户端高清电影电视剧纪录片动画片公开课播客CCTV频道栏目央视网新闻频道图片频道正文搜索央视网新闻官方微信扫一扫与我们互动新浪微博cntv微博一周图片精选1141110118查看原图一键分享：2013年11月11日0818上一图集下一图集关于CCTV联系CCTVCNTV介绍联系我们智囊团人才招聘版权声明法律顾问网站地图CCTV广告中心CNTV互动营销手机电视IP电视移动传媒中国中央电视台中国网络电视台版权所有京ICP证060535号网络文化经营许可证文网文2010024号网上传播视听节目许可证号0102004新出网证京字098号中国互联网视听节目服务自律公约
0000000000000314	两性养生：盘点性高潮的18大奇效组图性生活可以治病并不是什么天方夜谭。美好的生活，经常性获得性高潮对很多病症，都有意想不到的缓解和抑制作用。
0000000000000315	12家中国国际旅行社负责人到西青考察加强合作天津北方网讯：日前，区旅游局与天津蓝水阳光国际旅行社合作，邀请广东省江门佛山中山顺德等12家中国国际旅行社负责人到西青考察踩线。考察人员先后考察了石家大院杨柳青巨龙古玩城精武门中华武林园以及杨柳青年货街精武冰雪文化嘉年华等景点和活动。考察过程中，古玩城吉祥画馆年画制作过程体验年画鼻烟壶年画册页等丰富精美的年画衍生品引来众人纷纷购买，杨柳青年货街的窗花吊钱春联受到欢迎，精武冰雪文化嘉年华的滑轮胎冰滑梯羊拉雪撬刺激好玩，得到各旅行社的称赞和认可。中国国旅广东国际旅行社省外部总经理张帆表示，西青旅游环境非常好，景点具有特色，特别是年画制作体验丰富的年画衍生品都很有吸引力，连我这种老旅游人都禁不住买了好几个鼻烟壶，而且我们每个人都买了。通过此次考察，将进一步加强西青区与本市地接旅行社的合作，将更多的优秀旅游景点纳入2014年全市地接旅游产品系列中，扩宽景点销售渠道，扩大西青旅游的知名度。通讯员王旭
0000000000000317	可信网站验证是由中网knetcn推出的网站真实身份验证服务，但网站经营主体的运营状况财务状况信用状况等不在可信网站验证范围内。点击了解更多我也要申请2如何查验网站真实身份网站查验助手是由中网knetcn推出的一款查验网站真实身份的IE浏览器小工具，可查询域名信息IP信息可信网站验证信息等各类网站真实身份信息，同时，还可以一键举报钓鱼网站。我要下载体验
0000000000000318	研究发现电休克疗法可删除痛苦记忆图科学家成功利用电休克疗法消除人类的悲痛记忆，电影中的忘情诊所或能成真。星岛环球网消息：想要忘记痛苦的初恋吗科学家似乎找到了方法。一个来自荷兰的团队近日发现，通过电休克疗法可以清除了病人痛苦的记忆。广州日报引述美媒报道，这次试验也是科学家们第一次成功消除人类身上的特定记忆。电击后忘记悲惨故事该研究成果被发表在最新一期的自然杂志上。这个荷兰科学家团队在42名抑郁症患者身上进行了实验。在实验中，病人们首先看到一个用文字图片和视频呈现的两段悲惨故事。一个星期后，研究团队再次播放其中一个故事的片段来让病人回忆故事情节。随后，研究人员旋即对病人进行电击治疗。接下来几天，研究人员对病人进行以多选题为主的记忆测试，发现接受过电击的病人对之前播放过的两次悲惨故事的记忆留存越来越少。到后来他们什么也不记得了，回答问题几乎都是靠猜。荷兰奈梅亨大学神经学家该研究的主笔马亨特克罗斯说，电休克疗法的效果十分显著。未接受电休克治疗的病人则保留正常的记忆。首次消除人类记忆当然，这个电休克疗法也有弊端。首先，这项研究的实验对象是42位患有重度抑郁的病人，因此研究结果可能跟正常人稍有出入。其次，电休克疗法可能会让人产生痉挛抽搐的症状。克罗斯说，他们会进行进一步的研究，以改善病人的治疗体验。忘情诊所或成真这个试验让人想起电影美丽心灵的永恒阳光中的情节：一对情侣因为争吵而到忘情诊所去消除关于对方的回忆。实际上，近些年来，科学界一直在追求忘情诊所那项能够消除记忆的技术。今年10月，麻省理工大学的科学家就发现了删除记忆基因。但利用电休克疗法成功地消除人类身上的悲痛记忆，这在科学史上尚属首次。wwwstnncc
0000000000000319	中国海军会很快的拥有多艘航母吗自中国第一艘航母辽宁号入役后，很多军迷朋友认为中国将很快拥有多艘航母，并不时有中国已经在同时开造多艘航母的消息，对于这些消息的真假，由于涉及军事秘密，无据可考但是笔者根据自己的分析认为，中国需要航母，但现在不会多艘同时建造，我们知道辽宁舰是中国海军的第一艘航母，它担负的主要任务就是科研与实验，因为拥有中国的第一艘航母，很多东西对于中国军队来讲都是陌生和未知的，要了解使用并最终建造就必须进行大量的验证试验工作，通过验证才能对航母存在的问题进行改进，辽宁舰作为中国的首艘航母，其各项武备绝对不会什么都是完美无缺的，正是通过辽宁号的试验改进为中国自造第一代航母做技术准备工作，而中国的第一代航母一定是以辽宁号为蓝本的基础上改进的，以中国海军建设稳妥小步快跑的理念，中国就是现在开建航母也不会超过两艘，我们通过中国大型驱逐舰的建造历程就能推算出中国航母的建设思路，中国的第一批自造航母下水时间应该在国庆70周年，中国目前在建的航母与辽宁号相比只会有所进步，但步子不会太大，有网友认为中国应该建造技术尖端的航母，这种急于求成的想法不错，但实际操作上并不可行，航母建造是个系统工程，可以讲是集一个国家科技实力于大成，很多的军工高科技产品是买不来的，要靠自己一步一个脚印艰苦奋斗来的，中国目前在冲突中运用航母的时机并不成熟也不迫切，辽宁号航母在目前来讲并不先进，特别是它的滑跃式甲板严重制约了舰载机的战力，中国目前拥有航母只是在解决了有无的问题，熟练的操作运用航母还有待时日，现在的情况下同时制造多艘并不先进的大型舰从经济效益上和军事运用上讲绝不是明智之举，那么中国的第二代航母一定会在辽宁舰成熟的基础上研发的另一型航母，笔者设想中国的第三四艘航母一定会采取弹射起飞甲板，动力仍会采取的传统的常规动力，到了第三代第五第六艘时中国的航母就会运用核动力，舰上的各项武备将可与美国航母相媲美，这要一个时间过程，未来20年内中国将会拥有超过6艘以上的航母，届时世界热点地区一定会闪现中国航母编队的身影，努力走向蓝海的中国海军
0000000000000320	广东顺德乐从镇纳入佛山新城12月11日，广东省佛山市委秘书长郭文海在佛山新城乐从镇管理体制调整动员会上宣布，顺德乐从镇纳入佛山新城，调整后佛山新城将委托顺德管理，原有资产将与乐从镇资产合并。据了解，佛山新城于2003年启建，起始阶段名称为东平新城，后2011年更名为佛山新城。而佛山新城中德工业服务区和乐从镇整合后佛山新城管理区域将因此从26平方公里扩容至80平方公里。佛山市长刘悦伦表示，此举是佛山经济发展的重大事件，既将中德工业服务区产业平台的能量得到充分释放，同时也给顺德带来一个国际级产业平台。会上强调，佛山市政府同意新城和乐从今后财税新增部分留给新城乐从用于自身发展，明确和乐从财政合并为一级财政。在审批事权方面，顺德区委书记梁维东表示，顺德将全面向新城管委会和乐从政府下放经济建设和社会管理权限。原则上新城和乐从需要的，不影响全区平衡和统一的，都可以全面下放，能放的全放，可放可不放的坚决放。
0000000000000323	中国GDP约为日两倍日官员称应分割争端促进交流环球网报道记者赵衍龙据日本共同社1月20日报道称，针对中国2013年国内生产总值GDP达到日本的约两倍一事，日本官房长官菅义伟当日在记者会上说，即使存在个别问题，也将重视并向前推动战略互惠关系，表示应将钓鱼岛等问题分割开来促进双方交流。中国国家统计局20日发布消息称，根据初步核算结果，中国2013年全年国内生产总值GDP为568845亿元，按可比价格计算，比上年增长77。对此，日本朝日新闻20日刊文称，2013年中国的GDP已达到日本的大约2倍。报道称，按照目前汇率，中国的GDP换算成日元约为980万亿，而日本的GDP为480万亿到490万亿日元。中国的GDP在2010年首次超过日本，位列世界第二，仅次于美国。之后几年，中国的经济增长率一直高于日本，另外2013年日元持续贬值，与人民币兑换跌幅约为25，这在汇率换算时增大了两者之间的差距。日本官房长官菅义伟还指出，GDP居世界第二三位的中日经济关系会对世界经济产生影响，强调日后将继续关注中国经济的动向。免责声明版权作品，未经环球网Huanqiucom书面授权，严禁转载，违者将被追究法律责任。责任编辑：朱马烈原标题：中国GDP约为日两倍日官员称应分割争端促进交流本文来源：环球时报环球网
0000000000000324	环球股指：美股下挫道指跌043纽约金价下跌周四12月5日美国股市涨跌不一，道琼斯工业平均指数下跌6826点，收于1582151点，跌幅为043；纳斯达克综合指数下跌484点，收于403316点，跌幅为012；标准普尔500指数下跌777点，收于178504点，跌幅为043。欧洲主要股市涨跌互现，欧股风向标泛欧斯托克600指数下跌09，收报31441点，连续第五个交易日收低。主要区域股指中，英国富时100指数下跌02，收报649833点。法国CAC40指数下跌12，收报409991点。德国DAX30指数下跌06，收报908495点。当日，纽约黄金期货价格周四收盘下跌12，报每盎司123190美元。纽约原油期货价格周四收盘上涨02，报每桶9738美元。
