0000000000000121	Prada2014春夏广告新鲜出炉再次主打多种族面孔导语：在新鲜出炉的Prada2014春夏系列广告中，Steven再次主打了自己热衷的多种族面孔牌。Prada2014春夏广告新鲜出炉再次主打多种族面孔有MiucciaPrada的地方便有名摄影师StevenMeisel，这一对黄金搭档仿佛能纵横到这一个世纪末去。在新鲜出炉的Prada2014春夏系列广告中，Steven再次主打了自己热衷的多种族面孔牌。在2013秋冬广告的拍摄中，Prada启用了18岁的黑人模特MalaikaFirth，而最早一次与非裔模特合作可追溯到1994年的NaomiCampbell。VictoriasSecret大秀上有精彩表现的CindyBruna这次是在今年VictoriasSecret大秀上有精彩表现的CindyBruna，她热辣的呈现力给观众以深刻印象。这辑广告依旧采用了春夏大片中爱用的排排站的拍摄模式，配合Prada当季铺满当代艺术印花的设计给人一种眼花缭乱的缤纷之感。
0000000000000122	航拍返程高峰高速公路瞬间变停车场图摘要：大年初七2月6日，是春节假期上班前的最后一个假日。春运返程如期而至，大年初六初七2月67日，各地高速实行免费，因此高速公路瞬间变停车场。大年初七2月6日，是春节假期上班前的最后一个假日。春运返程如期而至，大年初六初七2月67日，各地高速实行免费，因此高速公路瞬间变停车场。第一务工人口大省广东省，进入广东的高速堵车情况尤为严重。对此，有媒体航拍广东春运返程高峰，来看看高速上的停车情况，入粤高速瞬间变成了大型的停车场，停满了各式大小的汽车。图为2月6日，记者航拍粤赣高速出现拥堵。网络编辑田艳敏
0000000000000125	河南女车主不堪罚款服毒续7人移交司法机关女车主不堪罚款服毒涉事7名执法人员被移交司法机关据河南省联合调查组消息，已将永城市公路局流动治超大队7名执法人员移交司法机关追究刑事责任；对永城市政府及交通系统16名领导和责任人分别给予撤职降级记过等处分；责令永城市人民政府河南省交通运输厅写深刻检查。央视记者王冰
0000000000000127	流动性紧张压制指数今日上证指数报212779点，跌2050点，跌幅095，成交61497亿元；深成指报814771点，跌8924点，跌幅108，成交76869亿元。中小板指报收492208点，跌3774点，跌幅076；创业板指报收125608点，涨008点，涨幅001。两市共有526家个股上涨，1734跌，涨跌比为13。非ST类涨停个股8家，无跌停个股。今天早盘两市受外盘上涨影响小幅高开，不过由于两市热点的持续性不佳，市场人气涣散，指数高开之后随即震荡回调，临近午盘金融板块曾有一波快速拉升护盘，但是两市跟风盘稀少，午盘之后两市继续回落两市收出放量中阴线，沪指跌破2150点一线平台。盘面上两市仅电信医疗等少数板块收红；公共交通船舶等板块跌幅居前拖累指数。综合来看，今天两市高开低走，量能相比昨天略有放大。我们认为年末流动性紧张以及热点持续性差是导致近期指数连续下跌的主要原因。今天1年期利率掉期飙升至5065创历史新高，银行间拆借利率也全线走高，本周周二和周四央行都没有任何逆回购操作放大了市场对于流动性紧张的担忧，资金的缺乏必然引发市场走弱。另外近期市场热点持续性比较差，这导致市场人气涣散，场内资金活跃度降低，即使面对权重的护盘也鲜有跟风。不过，由于近期市场的连续下跌，指数偏离5日均线过远，短线技术指标均处于超卖钝化状态，短期大盘技术性反抽要求愈来愈强烈。我们认为，短线大盘仍存技术性反抽要求，但资金压力使年底前大盘难有像样走势，元旦前后因流动性改善，大盘或将见底反弹。操作上，不追高，逢低关注国企改革概念券商保险放心保农业及低价绩优股，逢高减持垃圾股及高价高估值股，慎对创业板。
0000000000000128	特别项目穿越泥潭难倒女兵超级女兵在江苏卫视首播之后，女特种兵训练之残酷，一时之间成为人们争相议论的话题。据悉，今晚播出的超级女兵挑战将再度升级海上操划舟攀登将军岭，种种残酷的训练，无不挑战着女兵们身体和心理的极限。据悉，本期节目中主教官王伟设置了一项额外的任务泥潭匍匐和前倒训练，让女兵将接受体力和心理的双重考验。千万别小看泥潭任务，一方面40的高温泥潭下，完成匍匐前倒等一系列训练，体力消耗巨大。另一方面，此次项目中的泥塘堪称够恶心，漂浮物随处可见，匍匐的时候整个人更会完全没在泥潭里。记者徐子淇报道以上内容来自：城市晚报
0000000000000129	赴港产子中介转型鉴定胎儿性别准妈妈再掀赴港潮据中国之声央广新闻报道，赴港产子被叫停后，不少中介商转型求财，改做胎儿性别鉴定。根据记者调查，通过母体血液DNA鉴定胎儿的性别方法在香港已经存在多年，相对比较成熟，原理就是用母亲血液来进行男性基因的测试，但是准确率不能保证百分之百。昨天，广州有媒体就曝出，在香港有多家诊所均表示有此项的业务，而其中一家还宣称曾经做过上千例的此类鉴定。记者发现甚至有些香港诊所看中了商机绕开了中介直接在内地推广此项业务，报价在4千至5千港币不等。按照我国2003年颁布关于禁止非医学需要的胎儿性别鉴定和选择性别人工终止妊娠，但是在实际上由于内地以及香港两地法律的不同因而存在一定的衔接问题，监管难度很大。内地孕妇去香港进行胎儿性别鉴定，这背后，是观念落后两地法规衔接漏洞以及利益驱动共同制造的潜在风险。而内地香港法律存在的衔接困难，也导致了监管难题。按照我国2003年颁布的关于禁止非医学需要的胎儿性别鉴定和选择性别的人工终止妊娠的规定，禁止非医学需要的胎儿性别鉴定和选择性别的人工终止妊娠。而实施医学需要的胎儿性别鉴定，应当由实施机构三人以上的专家组集体审核。香港卫生署在答复记者咨询时称：香港目前并没有规范和管理对任何人知悉或透露胎儿性别的法律法规。广东卓建律师事务所律师余刚表示，内地孕妇赴港进行胎儿性别鉴定，正好是两地之间的一项法律监管空白，胎儿性别鉴定在内地不是合法的，而在香港是合法的；内地堕胎不违法，而香港堕胎又是违法的。很多求子心切的父母就通过在香港做胎儿性别鉴定，如果不是自己想要的结果再在内地堕胎。余刚表示，内地孕妇自己去做胎儿性别鉴定，不管是在香港和内地都是违法的，深圳中介如果明知孕妇去香港是做性别鉴定还介绍去，也负有连带的法律责任。在余刚律师看来，内地孕妇赴港进行胎儿性别鉴定和早期赴港产子比较相似，大规模赴港产子正好由于内地和香港相关法律的监管空白造成的。为保证香港居民权益，港府已在去年底完全叫停了赴港产子。余刚也希望国家能从法律层面对赴港性别鉴定的行为进行监管，防止灰色地带的存在。记者郑澍记者温飞
0000000000000130	美国参议员就美国安局监控事件起诉奥巴马政府原标题：美国参议员就NSA监控事件起诉奥巴马政府中新网2月13日电据外媒报道，13日，美国参议员兰德鲍尔就美国国家安全局NSA收集美国人电话数据一事起诉奥巴马政府。鲍尔称，他和保守派的积极分子组织自由工作提起了这一诉讼，既是为了他们自己，也是为了每一个拥有电话的美国人。该诉讼称，自2006年开始的这一大型数据收集项目，违反了美国宪法第四修正案对不合理搜查的规定。鲍尔要求结束这一由斯诺登曝光的监控项目。奥巴马政府坚称这一开始于前总统小布什任内的监控项目是合法的，此前的法庭判例也主要站在政府一边。鲍尔是美国国会参议院的资深参议员，也是可能的共和党总统候选人。在13日召开的新闻发布会上，他没有回答关于他可能的总统竞选的问题。
0000000000000133	男子为让死亡父亲叶落归根背尸千里回家图有殡仪车赶到现场，将小伙左一背着的尸体搬入车内。昆明电视台截屏图一名20余岁的湖北小伙，为了让逝去的父亲叶落归根，做出了惊人之举他背着父亲的尸体，从瑞丽乘坐大巴走了600多公里的路赶到昆明，目的是回到老家。11月6日，这个小伙子的行为在昆明被识破，尸体被殡仪馆拉走，警方也介入了调查。据介绍，小伙的父亲不幸病故，警方正在等当事人家属处理后事，随后再进一步调查此事。小伙背尸等车派出所介入殡仪车到场目击者介绍，当天中午，西山区昆州路路边有一名20岁出头的年轻小伙，身后背着一个50岁出头的男子，在路边等车。几小时后，目击者发现有殡仪车赶到现场，将小伙身后的男子搬入车内，其才明白这名小伙背的不是活人，而是一具尸体。听说他背的是他父亲。有目击者说，我们也不知道被背着的男子是怎么死的。当天下午，一辆殡仪车赶到现场，工作人员和小伙一起将遗体搬进车内银色铁皮箱内。不久有市民报警，派出所警察赶到现场后，对这名20多岁的男子进行了调查，了解死者的具体情况。这名20多岁的男子面色凝重。有知情人称，该男子背着尸体一直站在路旁，说是要背父亲回家，爹死了，儿子就在这里背着他，一动不动，背着尸体有两三个小时。另有目击者称，在警方调查死者儿子时耳闻，父亲死后，小伙就一直背着，当时长途客车驾驶员并没察觉异常。父亲死后儿子背尸乘大巴从瑞丽到昆明事后，小伙证实自己是死者的儿子，据他称，父亲是因为病重身亡，但他并不愿过多透露有关父亲死亡的具体情况。出警调查此事的警察说，死者的儿子说在瑞丽那边父亲就已经死了，说是得了肺结核，坐在车上他不敢说，说了怕人家就不让他坐车了。对于为何要从瑞丽坐大巴走了600多公里的路，将父亲尸体拉到昆明，有警察介绍，小伙是想将父亲带回老家。据了解，这名小伙是湖北人。警方表示，目前先让当事人家属将死者后事处理妥当，随后再进一步调查此事。
0000000000000135	美专家点出湖人两致命伤球员教练单挑疯狗赢大帝新浪体育讯北京时间1月13日消息，洛杉矶湖人微博最近11场输了10场，洛杉矶时报专栏作家麦克布莱纳汉指出过多的失误和制造失误能力不强是湖人的一大致命伤，接下来的客场之旅中如果湖人控制不住自身失误，他们的战绩可能会更糟。湖人队场均154次失误排名联盟第27位，可他们制造对手失误的能力更差，场均只能造成127次失误，这排名联盟第28位。自从加入球队成为首发控卫后，肯道尔马绍尔的表现要好于预期，但他在两项失误统计上都影响着球队。过去三场比赛马绍尔有14次失误，只有1次抢断，自从他加盟湖人后场均仅有033次抢断。在上周六惨败给快船的比赛中，失误更是让湖人很受伤。脚步速度，湖人主帅麦克德安东尼赛后说，我们在这方面完全跟不上对手。快船有16次抢断，而湖人只有2次，双方的确在脚步速度上差距明显。不过最让湖人球迷们悲伤的还是，球队并没有什么解决的办法。湖人三位受伤的控卫要等到两三周才能回来，他们只能希望内线球员能变成制造失误的大师，不过加索尔只有生涯新低场均029次抢断，希尔场均03次，萨克雷微博场均035次。国王的考辛斯以场均19次抢断领跑联盟大个子球员，接着是老鹰的米尔萨普，场均16次。湖人的抢断数同样在联盟排名靠后，场均65次抢断位列第28位。他们还能做什么呢自我两三岁时，就是这样打球，杨说道，你只需要享受比赛。作为湖人的一员，你要以球队为荣，享受比赛带来的乐趣。可接下来等待湖人的将是漫长客场旅行的考验，如果他们在这几方面没有进步的话，他们可能很难享受到比赛带来的乐趣。湖人主要替补亨利已经恢复训练，他在训练场上和助教马德森刘易斯进行一对一的对抗练习。在这场球员和助教的比拼中，最后获胜的竟是马德森。亨利微笑着说：他在我面前投进了一个中投，因此马克赢了。
0000000000000137	朝鲜所扣美国人望美援助美促朝鲜赦免释放图中新网1月21日电据中央社报道，遭朝鲜监禁1年多的美国人裴俊浩20日首度露面，美国国务院发言人普萨基表示，美国仍强烈要求朝鲜当局赦免并释放裴俊浩。朝鲜扣留的韩裔美国人裴俊浩20日在朝鲜首都平壤举行新闻发布会，承认对朝鲜犯下严重罪行。裴俊浩还呼吁美国政府尽最大努力确保他获释，我知道自己是当前在朝滞留最久的美国人，希望美国政府能够和朝鲜政府紧密合作，使我早日获释。普萨基对此表示，已得知媒体报道，美国对裴俊浩的健康保持高度关注，并持续强烈要求朝鲜当局特赦裴俊浩，并立即释放。普萨基指出，美国持续积极运作，并要求朝鲜方面释放裴俊浩，包括与瑞典驻平壤大使馆进行定期密切讨论。她重申，保护海外美国公民是美国国务院一项重要责任。据报道，裴俊浩当天在平壤友谊医院与有限数量的外国媒体记者见面。美联社记者描述，裴俊浩戴着一顶灰色帽子，身穿灰色囚服，胸前印着编号103。他用韩语讲话，发布会持续大约3分半钟，结束后由两名朝鲜看守带离现场。裴俊浩现年45岁，从事旅游业，同时传教。2012年11月，他带游客从朝鲜咸镜北道罗津港入境后遭扣留。去年4月，朝鲜最高法院认定他从事反朝敌对行为，判处他15年劳动教养。遭扣留期间，裴俊浩经由代表美国利益的瑞典使馆同家人保持通话和书信联系。去年10月，裴俊浩因身体状况不佳住院后，他的母亲裴明姬前往朝鲜探视。
0000000000000138	虽然有水吃但跑水问题仍悬而未解兰州晚报讯11月14日，武都路198号到206号150户居民终于供水了，但是水闸一开却发现，短短十多分钟，总水表显示使用了15吨水，跑水情况依然存在，居民们仍然未在地沟中找到问题。为确保大家的供水安全，居民们只能自查跑水原因。居民们也表示，一定帮老周把垫付的钱全部收回来。跑水原因还得居民自己找14日上午9时许，居民们已经在楼门口等待自来水公司的工作人员开阀供水。当阀门一开，有心的居民掐表一算，发现短短十多分钟15吨水就没了，大家判断跑水现象依然存在，一居民下到地沟查看却并未发现任何异常。此时威立雅水务集团的工作人员口头向居民说明跑水现象该如何检查后便离开了，庆阳路房管所工作人员做了简单检查后并未说明原因，无奈查找跑水原因的任务落在了150户居民的身上。由于该小区没有物业公司，平时各种杂事除了周师傅，还有不少热心居民上心帮助。此时，大家最担心的是如果查不出哪里在跑水，将来跑水现象定会越来越严重，这次大家决心一定要找出原因。工作人员说没有设备帮助我们找，只能我们自己想办法找原因，如果地沟里没有发现跑水迹象，可能是暗埋在地下的管道出了问题，我们准备先在未进楼院的管道上安装一个水表，观察水表变化，如果还是不行，我们就挨家挨户查管道看看到底哪里跑水。由于现在跑水原因不明确，为了不造成大量跑水损失，业主们决定在没有查出原因之前，采取中午和晚上限时供水，保证大家正常生活的同时，尽快查出跑水原因。把周师傅垫的钱都还给他跑水问题是关系到每家每户的大事，13日，收费员周师傅为了让大家吃上水，自己拿出一万元先解决眼前的困难，但是周师傅也不免担心有水了之后，部分居民要是不交钱，他的辛苦钱岂不是打了水漂大家决定帮助周师傅一起收费。据了解，截至14日，小区还有40户居民家的水表未抄，现在只要周师傅抓紧抄完，用总用水量减去居民实际使用量，那么剩余的部分，由150户居民平摊，小区的单元代表会帮助老周一起收费，如果遇到拒不缴费的居民，小区其他居民也会主动做工作，新华巷社区的工作人员也会帮忙把周师傅垫付的钱全部收齐。以上内容来自：兰州晚报
0000000000000139	中国移动明年1月起销售iPhone美国苹果公司22日宣布，已和中国移动通信就销售苹果的智能手机iPhone达成协议。中国移动目前拥有约76亿用户。苹果希望通过中国移动销售iphone来获得新的客户，并在不断增长的中国市场与韩国三星电子抗衡。据称，中国移动计划从2014年1月17日开始，销售苹果于2013年9月推出的最新机型iPhone5S和5C。苹果公司首席执行官CEO蒂姆库克在相关声明中表示，中国是极其重要的市场。此前，苹果已经开始向中国的其他大型移动通信商供应iPhone，但与中国移动的谈判却一直进展缓慢。中国移动稍早曾宣布，到2013年末为止，将在北京上海等16个城市构建可实现高速通信的LTE服务网络，相关服务到2014年末将扩大至超340个城市。
0000000000000140	在这儿御用燕窝为母爱
0000000000000141	城镇失独家庭每人每月补340元优先安排住保障房记者26日从国家卫生计生委获悉，日前，国家卫生计生委民政部财政部人力资源和社会保障部住房和城乡建设部五部委联合印发了关于进一步做好计划生育特殊困难家庭扶助工作的通知，提出对计划生育特殊困难家庭要加大经济扶助力度，做好养老保障工作，提高医疗保障水平，广泛开展社会关怀活动。1提高特别扶助金标准通知提出，自2014年起，将女方年满49周岁的独生子女伤残死亡家庭夫妻的特别扶助金标准分别提高到城镇每人每月270元340元，农村每人每月150元170元，并建立动态增长机制。中央财政按照不同比例对东中西部地区予以补助。2给予参保缴费补贴通知明确，对符合条件的计划生育特殊困难家庭成员参加新型农村社会养老保险城镇居民社会养老保险的，应当按照规定给予参保缴费补贴。对60周岁及以上的计划生育特殊困难家庭成员，特别是其中失能或部分失能的，要优先安排入住政府投资兴办的养老机构。有条件的地方可对计划生育特殊困难家庭成员中的生活长期不能自理经济困难的老年人发放护理补贴。3纳入医疗救助范围通知要求，各地要将符合条件的低收入计划生育特殊困难家庭成员纳入城乡医疗救助范围，给予相应的医疗救助，并帮助其参加城镇居民基本医疗保险或新型农村合作医疗。鼓励和支持各级医疗机构开通绿色通道，建立社区医疗服务巡诊制度，为计划生育特殊困难家庭提供便利的就医条件。4优先安排住保障房通知强调，对生活贫困住房困难的计划生育特殊困难家庭申请廉租房公租房等保障性住房的，要优先给予安排；对农村计划生育特殊困难家庭，要按照有关规定优先纳入农村危房改造范围。5优先安排收养子女对符合条件有收养意愿的计划生育特殊困难家庭，在同等条件下，优先安排其收养子女。此外，还要加大对残疾独生子女的帮扶力度，逐步实行高中阶段免费教育，鼓励参加职业技能培训。据新华社
0000000000000142	泰国红衫军领导人在家中遭多次枪击身负重伤泰国红衫军核心成员宽猜KwanchaiPraipana当天在位于乌隆府的家中遭到枪击，身受重伤。图片来源：泰国媒体据泰国媒体报道，泰国红衫军领导人之一宽猜KwanchaiPraipana1月22日在位于乌隆府的家中遭到枪击，身受重伤，现正在医院接受治疗。据悉，宽猜的胳膊和腿部受到多次枪击，不过，目前已脱离危险。泰国警方正在对袭击事件展开调查，目前已在宽猜家围墙附近发现了约30个M16突击步枪子弹的空弹壳，围墙距宽猜的房子大约200米。近日，泰国反政府示威活动持续不断，看守政府21日宣布，在首都曼谷与周边的巴吞他尼府北榄府及暖武里府部分地区实施60日紧急状态法，22日生效，政府称此举旨在避免暴力升温，暂未有计划驱散示威者。不过，目前尚无法确定宽猜遭枪击事件与示威活动有关。责任编辑：刘洋
0000000000000143	嫦娥三号成功唤醒我国突破探测器月夜生存技术组图记者从国防科工局获悉，12日8时21分，嫦娥三号着陆器接受光照自主唤醒。此前，玉兔号月球车11日5时许也自主唤醒。两器在月球上安全度过首个月夜，经受了长达14个地球日的极低温环境考验。这标志我国成功突破了探测器月夜生存技术。目前，嫦娥三号着陆器和玉兔号月球车工作状态正常，地面各测控站和中心数据接收及处理正常。
0000000000000144	苏格兰警用直升机坠毁英政府降半旗哀悼环球时报驻英国特约记者孙微英国广播公司BBC12月1日称，苏格兰警用直升机于当地时间11月29日晚10时30分坠毁，目前已有8人遇难，32人受伤，其中14人伤势严重。直升机坠毁在苏格兰格拉斯哥的TheClutha酒吧屋顶，当时酒吧内有120多名顾客正在观看乐队表演。卫报称，警方已开始调查直升机坠毁的原因。苏格兰首席大臣亚历克斯萨尔蒙德要求政府机构降半旗致哀，以纪念格拉斯哥和苏格兰黑暗的一天。中央乔治广场的圣安德鲁节庆祝活动也被取消。警方已经确认8名死者中，包括3名直升机内的警员和飞行员，5名酒吧顾客。其中一名受害者已确认是飞行员前英国皇家空军上尉大卫特雷尔，另一名是女警察科斯蒂内利斯，还有一名是48岁的加里亚瑟。来自警方消防和救援服务的工作人员仍在现场救援，警方仍希望在废墟下找到生还者。英国女王和首相卡梅伦对受害者表示慰问，并对赶来帮忙的普通格拉斯哥人表示感谢。据目击者称，直升机像一块石头从天而降直接将屋顶压垮。酒吧瞬间黑掉并充满尘土，生还者称酒吧里一片漆黑很难呼吸。尽管场面混乱，一些伤者路人和附近的居民在救护人员赶来之前就开始自发抢救伤员。失事飞机为欧洲直升机公司的EC135T2型，初步认定是飞机因突然失去动力导致了这场灾难。航空专家表示该机型有良好安全记录，但是最近有些安全警示。每日电讯报称，欧洲直升机公司去年曾因安全考虑令整个EC135s机型的直升机停飞。2012年4月，BondAirServices发现苏格兰救护直升机上使用的主旋翼轴上有裂缝，他们将这一故障通报给了厂家欧洲直升机公司。欧洲航空安全局发出适航指令，要求BondAirServices对所有的EC135s飞机进行日常检查。欧洲直升机公司随即要求所有相关直升机在当月停飞进行检查。
