0000000000000002	图刊冰封之国
0000000000000003	湖北政协原副主席陈柏槐被调查陈柏槐湖北省政协原副主席陈柏槐正接受组织调查据中央纪委消息，湖北省政协原副主席陈柏槐涉嫌严重违纪违法，目前正接受组织调查。央视记者刘珺陈柏槐同志简历陈柏槐，男，1950年8月出生，汉族，湖北武汉人，1973年6月加入中国共产党，1971年11月参加工作，在职硕士研究生学历，华中师范大学旅游学院区域经济学专业毕业。现任中共湖北省委委员省农业厅厅长党组书记。其主要经历是：197111197409新洲县旧街区农业技术员；197409197609黄冈地区农业学校学习；197609197810黄冈地区革委会农办干部；197810198209湖北省委农办干部；198209198507华中农学院农经系农业经济管理学专业学习；198507198705湖北省政府办公厅农业处干部；198705199102湖北省政府办公厅农业处副处长；199102199503湖北省政府办公厅农业处处长；199503199706湖北省水利厅副厅长；199706200011湖北省政府副秘书长其间：199709199901华中师范大学旅游学院区域经济学专业在职研究生学习；200011200205湖北省政府副秘书长，省政府参事室主任；200205200301湖北省政府副秘书长，省农业厅党组书记，省政府参事室主任；200301200302湖北省政府副秘书长，省农业厅厅长党组书记，省政府参事室主任；2003022009湖北省农业厅厅长党组书记其间：200510200601中央党校第45期进修二班学习；
0000000000000004	中国古代的间谍工具更高级的窃听器：矢服。出于传递情报需要而发明的风筝。说到间谍工具，就不能不提一下间谍。间谍，就是所谓的情报人员，也叫特务特工。西方学者认为，人类间谍鼻祖是公元前十世纪时名叫娣莱拉的菲利斯女人，实际上中国早在公元前二十世纪前后的夏代前期就出现了间谍，而且也是一位女人，名叫女艾。间谍出现都这么早，搜集情报的手段和间谍工具自然也不会落后。其中有四种为国际情报界人士瞩目，可谓间谍工具上的中国四大发明。
0000000000000005	全国小产权房摸底排查国土部存量房有望转正存量小产权房未来或有制可寻。近日，记者从知情人士处获悉，国土资源部正在研究出台小产权房管理办法，未来或将根据出租和出售等性质类别，分类整理存量小产权房。随后，记者分别从国土资源部和北京市国土资源局得到证实，国土资源部目前已就小产权房的处理成立了专项研究小组，希望能尽快推出管理办法。目前的主要思路是，针对新增项目的清理，保证不再有新上市项目；而对于存量小产权房，现在处于研究阶段，研究方向倾向于逐步分类整理，区分出租和出售等类型出台相应办法统一管理。此前针对在建在售小产权房的清理工作已率先在北京展开，并针对小产权房的存量情况进行了摸底排查。目前该项摸底已扩展至全国，河北海南山西等地已就此出台了相关政策，将陆续开展清理排查工作。摸清在建在售已售小产权房的总体情况与数量，对制定小产权房管理方案意义重大，目前编制小产权房的管理办法已提上日程，但具体方案出台时间还有待进一步确定。上述知情人士表示。增量房严格清理11月22日，国土资源部住房和城乡建设部联合下发的坚决遏制在建在售小产权房的通知，让此前的小产权房转正传闻戛然而止，也表明了中央部委对于小产权房的整治决心。小产权房治理要区分类别。国土资源部相关人士对记者表示，在严格清理增量小产权房的同时，也要处理好存量小产权房，要对症下药实行综合治理。目前，对于增量小产权房的清理已在北京展开。而一直以来北京市的清理动作和管理方法，都在全国产生示范效应。从2012年起，国家就把北京上海列为全国小产权房清理的试点城市。其中北京昌平通州两地更是重中之重。自试点以来，北京对小产权房的清理就开始加大力度，从以往的喊话，到现在落实各种清理处罚。自2012年到2013年11月底，北京市国土资源局已先后5次公布小产权房和变相小产权房项目，共计108个，主要集中在昌平区房山区怀柔区和通州区，其中昌平区数量最多，占四成左右。这108个中包括85个小产权房和23个变相小产权房，其中变相小产权房多以生态农庄农家院私家菜园等各类名称出现。北京市国土资源局相关工作人员对记者透露，从今年上半年起，国土资源部小产权房的例行督查组就驻扎在昌平区，到现在为止都还没走，给昌平区提了三四百条整改意见，要求逐项解决。
0000000000000006	贵州凯里爆炸案件已造成15人死亡8人受伤13日发生在贵州省凯里市龙场镇老山村的爆炸案件，截至记者发稿时，确认造成15人死亡，8人受伤。目前伤者生命体征平稳。记者14日从贵州凯里113爆炸专案组了解到，经公安机关连夜侦查，初步查明爆炸发生在老山村荒无人烟的一偏僻山坡，爆炸死伤人员系涉嫌在此聚众赌博人员。公安机关现已刑事拘留犯罪嫌疑人8人，其中自首3人。案件发生后，当地党委政府负责人立即率公安武警消防卫生等有关部门人员赶到现场开展工作。公安部工作组已于14日凌晨赶到案件现场指导案件侦破。目前，公安机关正在对案件加紧进行深入调查，当地党委政府组织有关方面正全力开展善后处理事宜。记者杨洪涛
0000000000000008	郝鹏：加强公共文化服务深入推进文化惠民1月29日，省长郝鹏专程前往省文化新闻出版厅省广播电视局及省广播电视台调研。他强调，要不断推动文化新闻出版和广播电视事业发展迈上新台阶，进一步提升公共文化服务水平，更好地弘扬主旋律凝聚正能量。在青海民族出版社和青海人民出版社，郝鹏饶有兴趣地翻阅了他们出版的部分精品图书，详细了解出版社的管理运行选题策划出版发行等情况。他充分肯定了民族出版社独立运行和人民出版社转企改制后取得的成绩。他指出，出版事业要繁荣发展，必须坚定不移地走改革之路，始终保持创新进取精神，提升品质，打造品牌，不仅表现形式要新，而且题材内容要精。他希望两家出版社巩固老阵地开辟新战场，进一步做大做强。省演艺集团有限公司的乐团歌舞团戏剧团等排练厅里充满生机与活力，器乐合奏春节序曲民族舞蹈狂舞大锅庄京剧折子戏火烧于洪等正在紧锣密鼓地排练。郝鹏一行走进排练厅，与正在排练的演职人员亲切交谈。得知集团组建以来，人事制度分配制度艺术创作生产等全部企业化运行，演出场次大幅增加，人均工资比转制前有所提高时，郝鹏十分高兴，他说，转企改制增添了活力，产生了创造力，在艺术生产创作公益性文化服务对外文化交流等方面取得了很大的成绩，希望省演艺集团巩固成效再接再厉，坚持改革创新内涵发展，出人才出产品出效益，繁荣文化市场，服务人民群众。随后，郝鹏前往省广播电视局省广播电视台调研。在广播电视台播控中心新闻中心录播机房藏语中心录播机房等部门，郝鹏与编采人员亲切交谈，详细询问采访一线新闻工作者的工作生活情况，对青海藏语卫视实现中央电视台新闻联播当天全译全播等工作给予了充分肯定。郝鹏希望广播电视台继续弘扬主旋律，提高收视率，使传播平台有更重要的社会影响力。在广电信息网络公司，郝鹏要求切实保证广播电视节目安全传输，扩大中央和省级广播电视节目在我省藏区的有效覆盖，加快推进重点业务向网络数据业务转型，为全省有线电视用户提供安全优质服务。
0000000000000011	日媒地中海护航凸显中国远洋存在尽管美国及盟国认为北京在近海的行为正越发影响地区稳定，但中国正逐步实现对东亚之外的国际安全贡献的多样化。近期派遣护卫舰为销毁叙利亚化武护航，就反映出中国正在寻求新途径。这提醒人们，正在进行的反海盗努力已令中国获得一种富有成效的远洋存在。在亚丁湾的多年存在，令中国海军调遣盐城号军舰成为可能。中国媒体报道称，此次执行从叙利亚至意大利的护航任务，是解放军海军首次在地中海开展此类活动，是首演。但与这些报道相反，其实自2008年以来，中国一直在亚丁湾及其周边海域保持积极存在。从那时起，在亚丁湾部署的军舰就已令中国海军以反海盗名义频繁进入地中海。中国舰船早已熟谙地中海，过去10年内不断访问欧洲港口。自2002年首次开展环球航行以来，中国海军已多次造访埃及土耳其希腊和葡萄牙等国。除了外交友好访问，中国护航舰队还常在地中海开展补给和检修。此外，反海盗任务还令其探索了地中海的广大周边地区，包括黑海直布罗陀海峡和盐城号此次途经的红海。上述经历不但赋予解放军海军在全世界关注下为叙化武成功护航的自信和能力，还反映出北京已获得运用于多层面国际安全事务的信心和技能。中国海岸线距离亚丁湾约1万公里，离地中海更远。许多中国军舰需两周多才能抵达地中海。很难确定若缺乏在亚丁湾的海军存在，是否会阻碍中国派遣盐城号执行本次任务。5年的打击海盗活动，已成为中国开展海事和外交活动的跳板。但正如北京所学到的，与成功相伴而至的是不切实际的期望值，外界期待中国对21世纪面临的一系列国际安全威胁做出更有意义的贡献。有专家指出，中国海军在销毁叙化武中的作用被夸大了，其贡献远比不上一些国家。这也带来一个问题：当各国海军开始撤离亚丁湾时，中国今后将如何做出更有意义的贡献。中国军事专家认为，中国海军为销毁叙化武护航的行动，与中国对索马里附近海域的贡献极为相似，对中国海军而言，此类军事行动已如同在公园内散步。中国本次护航表明，反海盗行动已远超护航本身的意义。但反海盗使命非永久性平台，随着北京的国际安全活动与日俱增，需要找到支撑和维持此类活动的其他可靠途径。作者安德鲁埃里克森wwwstnncc
0000000000000012	浙江磐安一婚礼现场发生坍塌事故已造成6人死亡中新网金华2月13日电见习记者胡丰盛实习生李婷婷奚金燕13日晚17点25分，浙江磐安万苍乡乡政府旁边砖木结构的礼堂坍塌。记者从浙江省金华市委外宣办获悉，目前事故已造成6人死亡，10人重伤，约50人受伤。据了解，当时大会堂内正举行婚宴，有200多名村民参加。而倒坍的大会堂为砖木结构，建筑面积约400平方米，坍塌面积约300平方米。据悉，在20时05分，现场搜救结束，未发现有人员被埋压。而目前已有50多名村民被送往医院救治，其中10人重伤，6人抢救无效死亡。事故原因正在调查中。完
0000000000000014	中兴通讯推全球首款电信制式真八核手机售款全球电信制式八核手机青漾2新浪科技讯1月21日消息，中兴通讯于20日携手中国电信联发科以及威盛集团威睿电通发布全球首批电信制式真八核手机青漾2和MemoII。这两款产品均为第二代的机型，除了继承了第一代的出色设计外，还作了很大的升级，最主要的是均采用目前性能与功耗综合表现最出色的联发科MT6592八核处理器。据悉，中兴青漾2售价为1599元，6英寸的MemoII售价则为1999元，均在2000元以内，并且上市时间同为2014年2月28日。中兴青漾2搭载了联发科全新的17GHz真八核处理器，拥有1GBRAM8GBROM的内存组合，不仅带来更流畅的网页浏览体验和应用性能，并支持超高清的4K视频播放，实现对多媒体处理以及高端游戏支持。外观上，中兴青漾2采用了纯白的设计，搭载5英寸720P屏幕机身设计紧凑，三围仅为14272785mm，超薄的机身厚度带来良好的握持手感。中兴青漾2配备了一颗索尼800万像素的背照式摄像头，支持持续跟踪对焦，动作捕捉，零秒拍摄等多种拍摄模式，让拍照变得更加容易和有趣。但是其前置摄像头升级到了500万像素，适合年青消费者的需求。中兴MemoII延续上一代大屏幕的设计理念，60英寸1080P的IPS屏幕带来顶级的视觉体验。而为配合这块大屏幕，中兴也在系统方面作了一些针对性的研发，如智能分屏功能，一屏多用效率更高。与青漾2相同，MemoII同时是联发科17GHz真八核处理器，内存提升为2GBRAM16GBROM内存组合，更加适合追求高性能的消费者。中兴MemoII采用1300万像素索尼BSI镜头，前置为500万像素，并支持声照相跟踪拍照动作捕捉等拍摄模式，而零秒拍摄全景拍照美肤连拍等常规功能也一个不少。中兴通讯与中国电信经过长期深度的合作，这次发布的青漾2以及MemoII则是对市场深耕后的成果，满足中国电信对高性能以及高性价比产品的要求，从整个市场来看，将冲击原来中国电信体系的手机市场，也将全面中国电信手机的八核化。康钊
0000000000000015	郑洁无缘澳网混双决赛
0000000000000016	广东省新增2例人感染H7N9深圳江门各新增1例昨日，记者从省卫生计生委网站获悉，深圳市和江门市各新增1例人感染H7N9禽流感确诊病例。深圳的病例练某，是一位77岁的女性，广东人，现住深圳市龙岗区南湾街道。1月26日确诊为人感染H7N9禽流感病例，目前患者病情危重，在深圳市的定点收治医院住院；江门的朱某，是一位68岁的男性，职业为农民，现住江门市江海区礼乐街道，1月25日经抢救无效死亡。1月26日，确诊为人感染H7N9禽流感病例。记者还了解到，阳江市12月16日确诊的病例张某已治愈，于1月25日出院；深圳市1月11日确诊的病例赵某1月18日确诊的病例周某均已治愈，于1月26日出院。来源：南方日报作者：曹斯编辑：文芬
0000000000000017	意大利陆军航空兵司令在直升机事故中遇难新华网罗马１月２３日电记者刘宇意大利一架军用直升机２３日在意大利中部坠毁，陆军航空兵司令在这次事故中遇难。据安莎社报道，该直升机失事前正执行军事训练任务，事故共造成两人遇难，失事的直升机残骸已在意大利中部玛尔塔山附近被找到。遇难的两人中包括现任意大利陆军航空兵司令詹贾科莫卡利加里斯和一名中校。现年５７岁的詹贾科莫曾多次参与意大利参与的重大国际军事行动，曾担任意大利向伊拉克派遣的维和部队副司令员，驻阿富汗国际维和部队协调员，以及乍得海地地震后联合国派遣的国际维和部队协调员，并于去年３月出任意大利陆军航空兵司令。詹贾科莫曾被授予意大利共和国骑士勋章美国军功勋章和俄罗斯军事合作勋章。
0000000000000021	我在黎塘镇被一群狗辐射了一年
0000000000000019	过去30天蜀南网核心提示：11月8日，2013首届四川奥迪购车节盛大启动。据悉，本次活动分别设置了五大分会场。分属成都羊西奥迪4S店成都龙潭奥迪4S店泸州奥迪4S店南充奥迪4S店和德阳奥迪4S店蜀南网消息11月8日2小时前汽车点评营口行情原创近日，汽车点评网编辑从营口地区奥迪4S店获悉，即日起至2013年10月31日，奥迪A3部分车型最高优惠49万元，店内现车销售，感兴趣的网友可致电咨询更多详情。营口地区4S经销商2小时前车况介绍：外黑内棕原装导航天窗无钥匙启动原版原漆全程4S店保养新车开票82万上路90万新车一台。编号：8816联系我时，请说是在搜狐二手车看到的，谢谢1小时前当然，自驾旅行也要选择一款适合自己的车，最好能满足你旅行时所有的需求。接下来，小编就推荐四款进口旅行车供大家选择。2013款奥迪A4allroad车型在外观尺寸上与普通版车型相差不大2小时前因此大众本身部分车型和斯柯达的一些车型终究没有能经住考验，修吧奥迪的Stronic双离合变速系统也是其技术上的亮点之一但在这款低功率前驱车型上却配备的是CVT无极变速系统2小时前北京广州深圳成都是国内汽车消费的晴雨表，网上车市网站针对这四个地区所销售的热点车型以周为单位进行行情方面的调查，调差车型近百款，为广大准车主提供第一手行情信息，为您购车提供价格方面的指导。2小时前太平洋汽车网武汉新闻日前，编辑走访武汉奥迪华星汉迪4S店获悉，武汉华星汉迪为答谢新老客户的长期支持，在双十一期间推出一批特价车型，立享华中车展最低价，指定车型分期还可享18期0利率优惠政策2小时前奥迪A6L超级座驾非凡体验2013年11月10日金华博奥奥迪4S店C7彩色婚车队全城巡游7彩人生奥迪相伴为准新人带去双十一前夕爱的宣言与您的梦想座驾零距离接触。巡游地点2小时前2013年11月9日11月11日，由金华博奥奥迪4S店与多家高端品牌共同参展的金华首届婚庆文化博览会盛大开启现场除了为准新人们打造的婚购盛宴，更有三十款豪车免费试乘以及蒙面相亲派对大型主题婚礼秀2小时前
0000000000000022	中央要求各级党员学习世界社会主义五百年中宣部中组部发出通知要求组织学习世界社会主义五百年党员干部读本新华社北京2月10日电日前，中宣部中组部发出通知，要求认真组织学习世界社会主义五百年党员干部读本以下简称五百年。为帮助广大党员干部深入学习领会习近平总书记系列讲话精神，学习社会主义发展史，进一步增强中国特色社会主义道路自信理论自信制度自信，中央宣传部理论局组织马克思主义理论研究和建设工程专家编写了五百年。五百年从世界社会主义思想的源头空想社会主义讲起，分六个阶段概要叙述了世界社会主义波澜壮阔的发展历程，深刻阐明了我们党带领全国各族人民艰苦奋斗顽强拼搏，在艰辛的探索和实践中，开创和发展了中国特色社会主义。全书注重史论结合文风通俗，力求做到思想性针对性和可读性相统一。通知要求，各级党组织要把组织五百年的学习同学习贯彻党的十八大和十八届三中全会精神结合起来，同学习贯彻习近平总书记系列讲话精神结合起来，作为推进学习型马克思主义执政党建设学习型党组织创建的学习内容，紧密联系实际，深刻认识和把握共产党执政规律社会主义建设规律和人类社会发展规律。通知强调，各级各类党校行政学院和干部学院要把五百年学习纳入培训教学，各高校要把五百年作为师生理论学习的辅助教材。各级党委讲师团要围绕五百年内容，组织好对党员干部和基层群众的宣讲活动。世界社会主义五百年党员干部读本近日已由学习出版社党建读物出版社出版，在全国新华书店发行。完
0000000000000025	卫星拍摄中国雾霾图环球时报恐怖卫星拍摄到的中国雾霾图下面三张图，分别是2013年12月7日，10月25日和2012年1月10日，美国国家航空航天局的卫星，拍摄到的中国雾霾图。其中亮白色的代表是云雾，暗灰色的是遭到污染的大气
0000000000000026	官媒发布打贪官游戏网友称打不过来图游戏画面尽管玩法并不复杂，不过仍有不少网友对游戏表示了赞赏，认为这是官方媒体的创意之举，反应了当下大力反腐的社会现实。但也有网友表示该游戏在后期难度过大，微博网友山头草Tbag就称：后面的贪官太多，根本打不过来啊打贪腐游戏简介：中央重拳反腐，贪官闻风丧胆，百姓拍手叫好。干部清廉，民之所盼；政治清明，党之所倡；反腐肃贪，全民责任。不管是老虎还是苍蝇，点击鼠标，挥动电棒，让其现出原形。反腐排行榜，走你美国媒体称，官员腐败在中国是个严重的问题：中国国家主席习近平公开承诺要打击腐败。2013年皮尤研究中心的一项调查结果显示，53的中国人认为腐败是非常严重的问题。然而在中国，打击贪污受贿不只是一道主席令；如今这已成为一个网上娱乐项目。美国外交政策双月刊网站1月6日报道称，人民微博当天推出了一款名为打贪腐的网络游戏。这款游戏很像打地鼠，玩家在腐败官员在监狱窗口出现时用电棍击中他们就可以得分。人民微博说：只要你轻轻一点鼠标，老虎苍蝇统统现出原形。你会是反腐英雄吗报道指出，该款游戏中有四种类型的腐败官员：第一种眼睛呈心形，嘴角流口水，这无疑比喻贪腐官员养情妇的偏好。第二种炫耀现金，很可能是贪污公款的官员；第三种官员似乎准备送出一袋钱；第四种拿着一个用于批准合同的红印章，这可能暗示滥用职权。玩家每成功打中一名官员可以得到100分，打中警察扣100分。在游戏中，警察也会出现在监狱窗口，诱使玩家错打。据报道，人民微博鼓励网民来玩这款游戏，称每个人都有打击贪腐的责任。
0000000000000027	2013款奔驰C级最高优惠16万元送装潢大礼近日，车讯网上海站编辑从上海东萌汽车销售有限公司了解到，现店内奔驰C级车型最高优惠16万元，有现车，购车送8800元装潢大礼包，零首付低利率快速办理银行按揭贷款，高价旧车置换。欢迎感兴趣的网友致电垂询经销商，具体车型信息请看下表：2013款奔驰C级报价表车型指导价万元现价万元优惠幅度万元现车情况C180经典型GrandEdition31502200950有现车C260优雅型GrandEdition358025301050有现车C260时尚型GrandEdition393028301100有现车C300运动型GrandEdition468030801600有现车全国销售送8800元装潢大礼包零首付低利率快速办理银行按揭贷款高价旧车置换制表车讯网金融政策：保险方面，以售价为425万的C200时尚旅行版车型为例，新车第一年保险费用在145万元左右。贷款方面，按央行基准利率首付30三年期计算，首付18万元左右包含车款上牌保险购置税和担保金等月供9000元左右。具体费用根据车型以到店核算为准。保养费用：奔驰C200旅行版车型享受两年不限公里整车质保。常规保养周期为每10000公里更换一次机油机滤，费用在2000元左右。更换机油三滤的费用在3000元左右，此保养费只作为参考依据，因为不同的保养材料会造成保养费用的差异。具体金额还要根据车况以到店核算为准。进口奔驰C级车型保养保险综合信息表
0000000000000030	10种蔬菜最适合冬天吃菜花包心菜冬季要养生，有哪些冬季养生菜可以吃呢今天中医向大家推荐10种最适合冬天吃的养生蔬菜。小白菜中医认为，小白菜养胃和中，味苦微寒，通畅利胃。小白菜富含维生素C和钙质，还含铁磷胡萝卜素和B族维生素等。还有洋白菜，即卷心菜，性味苦平，能益心肾，健脾胃，对胃及十二指肠溃疡有止痛促进愈合的作用。欢迎收听人民网健康官方微信：扫描下方二维码添加；或在微信上搜索人民网健康
